URL,Name,Rating,City,Jobs,Reviews,Best About,Description
https://itviec.com/companies/mb-bank/review,MB Bank,4.9,Ha Noi,34,124,Training & learning,Ngân hàng TMCP Quân Đội (MB)
https://itviec.com/companies/bosch-global-software-technologies-company-limited/review,Bosch Global Software Technologies Company Limited,3.4,Ho Chi Minh,19,304,Office & workspace,The Bosch Group is a leading global supplier of technology and services
https://itviec.com/companies/nab-innovation-centre-vietnam/review,NAB Innovation Centre Vietnam,4.6,Ho Chi Minh,17,69,Office & workspace,The NAB Innovation Centre Vietnam is owned by NAB - Australia’s largest ...
https://itviec.com/companies/one-mount-group/review,One Mount Group,4.4,Ha Noi,14,34,Office & workspace,ONE MOUNT | GROW TOGETHER
https://itviec.com/companies/panasonic-vietnam-group-panasonic-r-d-center-vietnam-prdcv/review,Panasonic Vietnam Group – Panasonic R&D Center Vietnam (PRDCV),4.3,Ha Noi,9,91,Office & workspace,Unlock PRDCV Potential for Future Growth!
https://itviec.com/companies/kms-technology/review,KMS Technology,4.0,Ho Chi Minh,8,257,Office & workspace,Building Products & Systems that Shape the Future
