URL,Name,Rating,City,Jobs,Reviews,Best About,Description,Location
https://itviec.com/companies/sps-vietnam/review,SPS Vietnam,3.7,Ho Chi Minh,1,27,Culture & fun,"The international leading IT company, awarded TOP 5 ICT in Vietnam","Saigon ICT Tower, Quang Trung Software City, Ho Chi Minh"
https://itviec.com/companies/thai-son-soft/review,Thai Son Soft,3.9,Ha Noi,1,27,Office & workspace,Công ty Phát triển công nghệ Thái Sơn là công ty hoạt động trong lĩnh vự...,"15 Dang Thuy Tram, Nghia Do, Ha Noi"
https://itviec.com/companies/chotot/review,Chotot,3.6,Ho Chi Minh,1,25,Office & workspace,Vietnam's leading online classified site with the passion to make life m...,"UOA Tower - 6 Tan Trao, Tan Phu, Tan My, Ho Chi Minh"
https://itviec.com/companies/travala-com/review,Travala.com,5.0,Ha Noi,1,25,Management cares about me,The world’s leading blockchain-based travel booking platform,"Tòa nhà Udic Complex, đường Hoàng Đạo Thúy, Phường Yên Hòa, Thành phố Hà Nội, Yen Hoa, Ha Noi"
https://itviec.com/companies/hansen-technologies/review,Hansen Technologies,4.6,Ho Chi Minh,1,23,Office & workspace,Hansen Technologies Limited,"100 Xuan Thuy, An Khanh Ward, Ho Chi Minh"
https://itviec.com/companies/vand-co-ltd/review,"VAND Co., Ltd",4.1,Ho Chi Minh,1,23,Culture & fun,"VAND Co., Ltd","Tầng 5, tòa nhà Devspace, 86-88 Lê Văn Duyệt, Gia Dinh, Ho Chi Minh"
https://itviec.com/companies/systemexe-viet-nam/review,SystemEXE Việt Nam,3.2,Ho Chi Minh,1,22,Training & learning,"Công ty IT Nhật Bản tại Việt Nam chuyên tư vấn, thiết kế, phát triển các...","Tầng 2, Etown1, 364 Cộng Hòa, Ho Chi Minh"
https://itviec.com/companies/vpbank/review,VPBank,3.4,Ha Noi,1,22,Salary & benefits,HOME OF TALENTS,"89 Lang Ha, Ha Noi"
https://itviec.com/companies/accenture/review,Accenture,3.6,Ho Chi Minh,1,21,Office & workspace,A global professional services company with leading capabilities in digi...,"9th Floor, Viettel Tower, 285 Cach Mang Thang 8, Hoa Hung, Ho Chi Minh"
https://itviec.com/companies/dts-software-vietnam/review,DTS Software Vietnam,4.0,Ha Noi,1,20,Management cares about me,EMPOWERING TECH – BUILDING OUR GREEN FUTURE,"Tầng 3, 266 Đội Cấn, phường Ngọc Hà , Ha Noi"
https://itviec.com/companies/dai-ichi-life-viet-nam/review,Dai-ichi Life Việt Nam,4.1,Ho Chi Minh,1,16,Salary & benefits,Dai-ichi Life Việt Nam,"149-151 Nguyen Van Troi, Ward 11, Ho Chi Minh"
https://itviec.com/companies/smartdev-llc/review,SmartDev LLC,3.7,Da Nang,1,16,Office & workspace,SmartDev LLC is an Agile Software Development Company.,"6th Floor, 81 Quang Trung, Thong Tan Xa Building, Da Nang"
https://itviec.com/companies/gem-corporation/review,GEM Corporation,4.1,Ha Noi,1,15,Culture & fun,GEM - Your Trusted Partner,"3F, The Nine Tower, 9 Pham Van Dong Street, Phu Dien Ward, Hanoi, Vietnam, Phu Dien, Ha Noi"
https://itviec.com/companies/rivercrane-vietnam/review,RiverCrane Vietnam,3.0,Ho Chi Minh,1,14,Management cares about me,Hãy cùng chúng tôi xây dựng và phát triển RiverCrane vững mạnh cùng với ...,"9F Havana Tower, 132 Ham Nghi Street, Ben Thanh, Ho Chi Minh"
https://itviec.com/companies/saritasa/review,Saritasa,4.4,Ho Chi Minh,1,14,Management cares about me,Your scalable-total-IT-solution service company.,"Tầng 7, toà nhà L’Mak Long Tower, số 101-103 Nguyễn Cửu Vân, Gia Dinh, Ho Chi Minh"
https://itviec.com/companies/bray-leino-splash-group/review,Bray Leino Splash Group,3.8,Ho Chi Minh,1,13,Office & workspace,"A part of Mission Group Plc, a full-service digital marketing agency hea...","Unit 01, Floor 13, Pearl Plaza Office Building, 561A Dien Bien Phu Street, Ward 25, Ho Chi Minh"
https://itviec.com/companies/datalogic-viet-nam/review,Datalogic Việt Nam,3.8,Ho Chi Minh,1,13,Culture & fun,A 100% foreign owned company belonging to DATALOGIC S.p.A (Italy),"Datalogic Vietnam LLC. F04, Lot I-4A, Saigon High Tech Park, Tang Nhon Phu, Ho Chi Minh"
https://itviec.com/companies/eastgate-software/review,Eastgate Software,4.0,Ha Noi,1,13,Culture & fun,"Eastgate Software, a Global Fortune 500 Strategic Partner","11th Foor, VCCI Tower, 09 Dao Duy Anh, Dong Da, Hanoi, Ha Noi"
https://itviec.com/companies/epos-vietnam/review,EPOS Vietnam,4.5,Ho Chi Minh,1,13,Office & workspace,Singapore's #1 POS system vendor empowering SMEs with powerful digital s...,"9 Dinh Tien Hoang, Tan Dinh Ward, Ho Chi Minh"
https://itviec.com/companies/fitech/review,Fitech,4.0,Ha Noi,1,13,Salary & benefits,Providing a qualified service for your ICT resources requirement,"7th Flr., A-B Tower, Imperia Garden Building, 143 Nguyen Tuan Str., Ha Noi"
https://itviec.com/companies/template-net/review,Template.net,3.6,Ho Chi Minh,1,13,Office & workspace,"A global platform for templates, graphic designs  &amp; documents with o...","Phòng 6.5, Etown 2, 364 Cộng Hòa, Phường Tân Bình, Ho Chi Minh"
https://itviec.com/companies/ghn/review,GHN,3.8,Ho Chi Minh,1,12,Office & workspace,Giaohangnhanh (GHN) is a leading technology-driven logistics company in ...,"3rd Floor, Rivera Park Building, 7/28 Thanh Thai, Ho Chi Minh"
https://itviec.com/companies/smilegate-vietnam/review,Smilegate Vietnam,4.5,Ho Chi Minh,1,12,Salary & benefits,"A FANSTATIC PLACE TO WORK! We develop global, top performance digital ga...","CII Tower, 152 Dien Bien Phu, Ward 25, Thanh My Tay, Ho Chi Minh"
https://itviec.com/companies/techcom-securities/review,Techcom Securities,3.8,Ha Noi,1,12,Culture & fun,Chúng tôi mang đến những trải nghiệm mới về đầu tư tích lũy của bạn!,"191  Ba Trieu, Ha Noi"
https://itviec.com/companies/ngan-hang-tmcp-tien-phong-tpbank/review,Ngân hàng TMCP Tiên Phong | TPBank,3.4,Ha Noi,1,11,Salary & benefits,Ngân hàng Thương mại Cổ phần Tiên Phong (TPBank),"57  Lý Thường Kiệt, Ha Noi"
https://itviec.com/companies/scc-vietnam/review,SCC Vietnam,4.5,Ho Chi Minh,1,11,Salary & benefits,SCC Vietnam,"1060 Nguyen Van Linh, Tan Phong, Ho Chi Minh"
https://itviec.com/companies/vulcan-labs/review,Vulcan Labs,3.8,Ho Chi Minh,1,11,Office & workspace,Vulcan Labs,"Vulcan Labs, 11-13-15, Street No. 7, An Khanh Ward, Ho Chi Minh City, An Khanh, Ho Chi Minh"
https://itviec.com/companies/asilla/review,Asilla,4.5,Ha Noi,1,10,Salary & benefits,Start-up tiên phong trong mảng trí tuệ nhân tạo,"Tầng 3, số 6 ngõ 82 Duy Tân, phường Dịch Vọng Hậu, Ha Noi"
https://itviec.com/companies/pixelz/review,Pixelz,4.2,Ha Noi,1,10,Office & workspace,"Leading product image editing service for internet retailers, designers,...","107 Nguyen Phong Sac, Dich Vong Hau, Ha Noi"
https://itviec.com/companies/posco-dx-vietnam/review,POSCO DX VIETNAM,3.0,Ho Chi Minh,1,10,Office & workspace,"Posco DX Vietnam, một thành viên tập đoàn Thép POSCO Hàn Quốc","6th Floor, Cobi Tower 1, 5 Hoang Van Thai St, Phu My Hung, Ho Chi Minh"
https://itviec.com/companies/vietunion-payoo/review,VietUnion (Payoo),3.9,Ho Chi Minh,1,10,Culture & fun,"Payoo, One-Stop Payment – Một điểm đến cho mọi thanh toán","35 Nguyễn Huệ, Sai Gon, Ho Chi Minh"
https://itviec.com/companies/ohmyhotel-co-vn-co-ltd/review,"Ohmyhotel&Co VN Co.,Ltd",3.9,Ho Chi Minh,1,9,Salary & benefits,Ohmyhotel&amp;Co Group is a Travel Tech company transforming the travel ...,"7th Floor, Mach Building, 127 Ung Van Khiem, Ho Chi Minh"
https://itviec.com/companies/rowboat-software/review,ROWBOAT SOFTWARE,4.7,Ho Chi Minh,1,9,Management cares about me,Coming together is a beginning. Keeping together is progress. Working to...,"28 Le Trung Nghia, Ho Chi Minh"
https://itviec.com/companies/gemcommerce/review,GemCommerce,3.9,Ha Noi,1,8,Management cares about me,EMPOWERING ECOMMERCE EXPERIENCE,"5th floor, Artemis Tower No. 3 Le Trong Tan, Khuong Mai, Ha Noi"
https://itviec.com/companies/ambition-vietnam/review,Ambition Vietnam,4.4,Ho Chi Minh,1,7,Management cares about me,"AMBITION VIETNAM CO., LTD. (https://am-bition.vn)","7th floor, Loyal building, 151 Võ Thị Sáu, phường Võ Thị Sáu, quận 3, TPHCM, Ho Chi Minh"
https://itviec.com/companies/euroland-asia/review,Euroland Asia,4.4,Ha Noi,1,7,Culture & fun,"Euroland IR Vietnam - Công ty phần mềm tài chính, quan hệ nhà đầu tư hàn...","1 Thai Ha, Dong Da, Ha Noi"
https://itviec.com/companies/homebase-vietnam/review,Homebase Vietnam,4.3,Ho Chi Minh,1,7,Culture & fun,HOMEBASE HOMES,"Circo Co-working Space, H3 Building, 384 Hoang Dieu, Khanh Hoi, Ho Chi Minh"
https://itviec.com/companies/titan-dms/review,Titan DMS,4.0,Ho Chi Minh,1,7,Office & workspace,Titan DMS is a leading developer and supplier of cloud based software so...,"182 Lê Đại Hành, Ho Chi Minh"
https://itviec.com/companies/vnpt-epay/review,VNPT EPAY,4.1,Ha Noi,1,7,Culture & fun,Công ty Cổ phần Thanh toán điện tử VNPT EPAY,"Tầng 14, Tòa Handico Phạm Hùng,, Ha Noi"
https://itviec.com/companies/eup-group/review,eUp Group,4.2,Ha Noi,1,6,Culture & fun,eUp là đơn vị tiên phong trong xây dựng nền tảng giáo dục thông minh,"Toà nhà Toyota Thanh Xuân - 315 Trường Chinh, Ha Noi"
https://itviec.com/companies/mealsuite/review,MEALSUITE,4.5,Ho Chi Minh,1,6,Training & learning,MealSuite - Delivering Smiles &amp; Satisfaction to the Continuum of Car...,"Cobi Tower 1, 69 Hoàng Văn Thái street, Phú Mỹ Hưng, Ho Chi Minh"
https://itviec.com/companies/semrush/review,Semrush,4.8,Ho Chi Minh,1,6,Management cares about me,Semrush - Join us to fire up your career!,"15/8 Lê Thánh Tôn, Sonatus Building, Ho Chi Minh"
https://itviec.com/companies/fujifilm-business-innovation-viet-nam/review,FUJIFILM Business Innovation Việt Nam,5.0,Ho Chi Minh,1,5,Training & learning,FUJIFILM Business Innovation Việt Nam,"20th Floor, Hallmark Building, No.15 Tran Bach Dang Street, An Khanh Ward, Ho Chi Minh"
https://itviec.com/companies/unity-sport-jsc/review,Unity Sport JSC,5.0,Ho Chi Minh,1,5,Office & workspace,Xây dựng nền tảng dữ liệu thời gian thực cho hàng triệu người dùng toàn cầu,"5th Floor – Lumiere Building, 628A Vo Nguyen Giap street, An Phu Ward , Ho Chi Minh"
https://itviec.com/companies/cube-system-viet-nam/review,Cube System Việt Nam,4.0,Ho Chi Minh,1,4,Management cares about me,Công ty TNHH Cube System Việt Nam,"4th Floor, ICT2 (Tech Valley) Building, Lot 46, Quang Trung Software City, Trung My Tay, Ho Chi Minh"
https://itviec.com/companies/global-design-it-co-ltd/review,"GLOBAL DESIGN IT Co., Ltd.",5.0,Da Nang,1,4,Management cares about me,"GLOBAL DESIGN IT Co., Ltd.","Tầng 17, Tòa nhà công viên phần mềm, 02 Quang Trung, Hai Chau, Da Nang"
https://itviec.com/companies/neos-viet-nam/review,Neos Việt Nam,4.0,Ha Noi,1,4,Salary & benefits,Neos VN là công ty IT 100% vốn Nhật Bản chuyên sản xuất phát triển phần ...,"Tầng 7, tòa nhà Ocean Park, số 1 Đào Duy Anh, Ha Noi"
https://itviec.com/companies/olli/review,OLLI,4.0,Ho Chi Minh,1,4,Culture & fun,Công Ty Cổ Phần Công nghệ OLLI,"96 Nguyễn Thị Minh Khai, Phường Võ Thị Sáu, Ho Chi Minh"
https://itviec.com/companies/what3words/review,what3words,5.0,Others,1,4,Salary & benefits,what3words is helping everyone talk about everywhere!,"The Sentry, 15 Đ. Lê Thánh Tôn, Bến Nghé, Quận 1, Ho Chi Minh"
https://itviec.com/companies/xboss/review,xboss,3.3,Ho Chi Minh,1,4,Training & learning,Công ty TNHH Giải pháp Công nghệ Xboss,"111A Pasteur, Saigon Ward, Ho Chi Minh"
https://itviec.com/companies/abbank/review,ABBANK,3.7,Ho Chi Minh,1,3,Management cares about me,Cung ứng các sản phẩm - dịch vụ tài chính ngân hàng trọn gói,"2 - 2A Phan Dinh Giot, Ho Chi Minh"
https://itviec.com/companies/ada-beat-vietnam/review,Ada Beat Vietnam,4.7,Ho Chi Minh,1,3,Culture & fun,Ada Beat Vietnam,"F10, Thien Nam Office Building, No. 111 - 121 Ngo Gia Tu Street, Vuon Lai Ward, Vuon Lai, Ho Chi Minh"
https://itviec.com/companies/boxgate/review,Boxgate,3.0,Ho Chi Minh,1,3,Culture & fun,Welcome To Boxgates,"40 Hoa Đào, Phường 02, Ho Chi Minh"
https://itviec.com/companies/ngs/review,NGS,4.3,Ha Noi,1,3,Management cares about me,CÔNG TY CỔ PHẦN THIẾT BỊ VÀ TRUYỀN THÔNG NGS,"Tầng 4, tòa 6th Element Nguyễn Văn Huyên, Hà Nội, Nghia Do, Ha Noi"
https://itviec.com/companies/sgh-asia-ltd/review,SGH Asia Ltd.,3.0,Ho Chi Minh,1,3,Office & workspace,We Partner With Our Clients to Drive Real Innovation!,"SGH Building, 21/4 Nguyen Thi Huynh Street, Ward 8, Ho Chi Minh"
https://itviec.com/companies/solis-lab/review,SOLIS LAB,5.0,Ha Noi,1,3,Salary & benefits,A company with vast experience in full-stack branding and e-commerce dev...,"Tầng 4 - tòa nhà Hà Thành Plaza - 102 Thái Thịnh, Ha Noi"
https://itviec.com/companies/tadidi-jsc/review,Tadidi JSC,3.7,Ho Chi Minh,1,3,Management cares about me,Tadidi JV JSC is one of the leading company in products &amp; services f...,"Tòa nhà Waseco số 10 Phổ Quang, Tan Son Hoa, Ho Chi Minh"
https://itviec.com/companies/vtc-online/review,VTC Online,3.7,Ha Noi,1,3,Salary & benefits,Cuộc sống tươi đẹp,"18 Tam Trinh, Ha Noi"
https://itviec.com/companies/phu-hung-securities-phs,Phu Hung Securities (PHS),,,,,,,"Tầng 21, Phú Mỹ Hưng Tower, số 08 Hoàng Văn Thái, Phường Tân Phú, Tan My, Ho Chi Minh"
https://itviec.com/companies/dataxight,DataXight,,,,,,,"167 Tran Nao, An Khanh, Ho Chi Minh"
https://itviec.com/companies/gene-solutions,Gene Solutions,,,,,,,"186-188 Nguyễn Duy Dương, Phường 03, Quận 10, Ho Chi Minh"
https://itviec.com/companies/vietnamobile,Vietnamobile,,,,,,,"7  Chua Boc, Ha Noi"
https://itviec.com/companies/ngan-hang-thuong-mai-tnhh-mtv-ky-nguyen-thinh-vuong-gpbank,NGÂN HÀNG THƯƠNG MẠI TNHH MTV KỶ NGUYÊN THỊNH VƯỢNG (GPBANK),,,,,,,"45 Nguyễn Văn Huyên, Ha Noi"
https://itviec.com/companies/vinsprite-tech,Vinsprite Tech,,,,,,,"55 Hồ Hảo Hớn, phường Cầu Ông Lãnh, Ho Chi Minh"
https://itviec.com/companies/delements,Delements,,,,,,,"14/12C2 Ky Dong, Ward 9, Ho Chi Minh"
https://itviec.com/companies/papaya-insurtech,PAPAYA INSURTECH,,,,,,,"Sun Village, 2nd Floor, 31-33 Nguyen Van Dau, Binh Loi Trung Ward, Ho Chi Minh"
https://itviec.com/companies/aletech-technology-solutions-company,Aletech Technology Solutions Company,,,,,,,"Lầu 4, Tòa Nhà Labonita, Số 215 Nguyễn Gia Trí, Phường Thạnh Mỹ Tây., Ho Chi Minh"
https://itviec.com/companies/cong-ty-co-phan-chung-khoan-kafi,CÔNG TY CỔ PHẦN CHỨNG KHOÁN KAFI,,,,,,,"Sailing Tower, 111A Pasteur, Ward Sai Gon, Ho Chi Minh"
https://itviec.com/companies/blue-technology,Blue Technology,,,,,,,"508 Đ. Trường Chinh, Khương Thượng, Ha Noi"
https://itviec.com/companies/naviworld,NaviWorld,,,,,,,"Tầng 11, số 41 Hai Bà Trưng, Phường Cửa Nam, Ha Noi"
https://itviec.com/companies/hm-games,HM Games,,,,,,,"Hoàng Đạo Thúy - Trung Hòa - Cầu Giấy, Ha Noi"
https://itviec.com/companies/maximus-solution-company-limited,MAXIMUS SOLUTION COMPANY LIMITED,,,,,,,"3rd Floor, Kicotrans Building, No. 20 Song Thao, Tan Son Hoa Ward, Ho Chi Minh"
https://itviec.com/companies/shs-chung-khoan-sai-gon-ha-noi,SHS | Chứng khoán Sài Gòn - Hà Nội,,,,,,,"Số 43 Phố Lý Thường Kiệt, Cua Nam, Ha Noi"
https://itviec.com/companies/motorist-pte-ltd,Motorist Pte Ltd,,,,,,,12 Tai Seng Link #06-02 Singapore 534233
https://itviec.com/companies/porters-asia-vietnam-co-ltd,"Porters Asia Vietnam Co., Ltd.",,,,,,,"5th Floor, DALI Tower, 24C Phan Dang Luu, Ward 7, Ho Chi Minh"
https://itviec.com/companies/qh-distribution,QH Distribution,,,,,,,"58 Street No.1, Thu Duc Ward, Ho Chi Minh"
https://itviec.com/companies/rosen-engineering-vietnam,ROSEN ENGINEERING VIETNAM,,,,,,,"4th Floor, Dashaus Building, 340/3 Ung Van Khiem Street, Thanh My Tay, Ho Chi Minh"
https://itviec.com/companies/ai-di,AI+DI,,,,,,,"46 Bach Dang Street, Ward 2, Ho Chi Minh"
https://itviec.com/companies/trung-tam-cong-nghe-thong-tin-mobifone,Trung tâm công nghệ thông tin MobiFone,,,,,,,"Tầng 9-10, tòa nhà Thái Nam, đường Dương Đình Nghệ, phường Yên Hòa, Ha Noi"
https://itviec.com/companies/cong-ty-tnhh-socotec-viet-nam,CÔNG TY TNHH SOCOTEC VIỆT NAM,,,,,,,"Số 17 ngõ 575 Kim Mã, Giang Vo, Ha Noi"
https://itviec.com/companies/cong-ty-tnhh-roosterx-global,CÔNG TY TNHH ROOSTERX GLOBAL,,,,,,,"Tầng 5A, Nhà 25T2 - Lô Đất N05 - Khu Đô Thị Đông Nam, Đường Trần Duy Hưng, Phường Yên Hòa, Ha Noi"
https://itviec.com/companies/cong-ty-tnhh-cong-nghe-ttr-it,CÔNG TY TNHH CÔNG NGHỆ TTR IT,,,,,,,"Số 97 Đường N3C, KĐT The Global City, Phường Bình Trưng, Ho Chi Minh"
https://itviec.com/companies/hanoi-k-lab,Hanoi K-Lab,,,,,,,"Shophouse Vinhomes Gardenia, Ha Noi"
https://itviec.com/companies/koidra-tech,Koidra Tech,,,,,,,"Tầng 3, số 8-10 Tạ Hiện, Cat Lai, Ho Chi Minh"
https://itviec.com/companies/coderpush,CoderPush,,,,,,,"XYZ Building, 236/43/2 Dien Bien Phu Street, Gia Dinh Ward, Ho Chi Minh"
https://itviec.com/companies/cong-ty-tnhh-ai-med-engine,CÔNG TY TNHH AI MED ENGINE,,,,,,,"19 Sông Nhuệ, Tân Sơn Hoà, Ho Chi Minh"
https://itviec.com/companies/cong-ty-tnhh-menas,CÔNG TY TNHH MENAS,,,,,,,"Tòa Abacus, 58 Nguyễn Đình Chiểu, Ho Chi Minh"
https://itviec.com/companies/aladin-technology,Aladin Technology,,,,,,,"Tầng 4, Tòa nhà Văn Phòng HH1 Meco Complex, ngõ 102 Trường Chinh, Phương Mai, Đống Đa, Ha Noi"
https://itviec.com/companies/sieu-lien-ket,Siêu Liên Kết,,,,,,,"351B Nơ Trang Long, Phường 13, Q.Bình Thạnh, Ho Chi Minh"
https://itviec.com/companies/sports-marketing-software-services-co-ltd,"Sports Marketing Software Services CO.,LTD",,,,,,,"SMS Tower, Quang Trung Software City, Tan Chanh Hiep Ward, Ho Chi Minh"
https://itviec.com/companies/kalapa,KALAPA,,,,,,,"2nd floor, 58 To Huu street, Ha Noi"
https://itviec.com/companies/cong-ty-tnhh-thuong-mai-va-giao-nhan-van-tai-quoc-te-trang-huy,Công ty TNHH Thương mại và Giao nhận vận tải quốc tế Trang Huy,,,,,,,"Số 129 Phạm Văn Đồng, Xuan Dinh, Ha Noi"
https://itviec.com/companies/deutschfuns-com-vui-hoc-tieng-duc-cung-ai,Deutschfuns.com - Vui học tiếng Đức cùng AI,,,,,,,"07 Phan Đình Phùng, Phú Thọ Hoà, HCM, Ho Chi Minh"
https://itviec.com/companies/galaxy-holdings,GALAXY HOLDINGS,,,,,,,"Galaxy Innovation Hub, đường D1, Khu Công nghệ cao, Thành phố Thủ Đức, TP HCM, Ho Chi Minh"
https://itviec.com/companies/cong-ty-tnhh-renda,Công ty TNHH RENDA,,,,,,,"241 Điện Biên Phủ , Xuan Hoa, Ho Chi Minh"
https://itviec.com/companies/tag-worldwide,TAG Worldwide,,,,,,,"IM Tower 3 - 21st Floor, 29A Nguyen Dinh Chieu, Sai Gon Ward, Ho Chi Minh"
https://itviec.com/companies/d2m,D2M,,,,,,,"3 Đường Số 5, KDC Cityland Park Hills, Ho Chi Minh"
https://itviec.com/companies/cong-ty-tnhh-phan-mem-kksoft,Công ty TNHH Phần Mềm KKSoft,,,,,,,"261 Hoàng Văn Thụ, P. Tân Sơn Hòa, Ho Chi Minh"
https://itviec.com/companies/amb-software-services-limited,AMB Software Services Limited,,,,,,,"Location 1: Tầng 14, Tòa Nhà HM Town, 412 Nguyễn Thị Minh Khai, Phường Bàn Cờ, TP Hồ Chí Minh, Việt Nam, Ban Co, Ho Chi Minh"
https://itviec.com/companies/gits,GITS,,,,,,,"Trung Kính, Ha Noi"
https://itviec.com/companies/faraday-technology-vietnam,Faraday Technology Vietnam,,,,,,,"Phòng 602, 1003, 1004, 1401 Tháp Royal Tower B, Tòa Nhà Royal Centre, 235 Nguyễn Văn Cừ, Phường Nguyễn Cư Trinh, Q.1, TP.HCM, Việt Nam, Ho Chi Minh"
https://itviec.com/companies/merchant-mate,Merchant Mate,,,,,,,NSW Australia
https://itviec.com/companies/cong-ty-tnhh-teenup,CÔNG TY TNHH TEENUP,,,,,,,"Hà Nội: 61E Đê La Thành, phường Láng, Ha Noi"
https://itviec.com/companies/cong-ty-co-phan-jemmia,Công Ty Cổ Phần Jemmia,,,,,,,"48Bis Trần Đình Xu, cô giang, Ho Chi Minh"
https://itviec.com/companies/tin-hoc-dai-duong,Tin học Đại dương,,,,,,,"76 Đường 13, Vạn Phúc, Hiep Binh, Ho Chi Minh"
https://itviec.com/companies/nuri-flex-vietnam-company,NURI FLEX VIETNAM COMPANY,,,,,,,"08 đường D6, Khu phố 24, An Khanh, Ho Chi Minh"
https://itviec.com/companies/altaa-vistaa,Altaa Vistaa,,,,,,,"Ha Noi, Ha Noi"
https://itviec.com/companies/agileops,AgileOps,,,,,,,"Unit 03-04, 9th Floor, Flemington Tower,182 Le Dai Hanh St, Phu Tho Ward, HCM City, Phu Tho, Ho Chi Minh"
https://itviec.com/companies/cong-ty-co-phan-chung-khoan-kis-viet-nam,Công ty Cổ phần Chứng khoán KIS Việt Nam,,,,,,,"Tầng 3 và tầng 11, Tòa nhà TNR, số 180-192 Nguyễn Công Trứ, Phường Nguyễn Thái Bình, Ho Chi Minh"
https://itviec.com/companies/cong-ty-tnhh-thuc-pham-nfc,Công ty TNHH Thực Phẩm NFC,,,,,,,"Tầng 5, Tòa nhà SCIC Trương Định, phường Xuân Hòa, Ho Chi Minh"
https://itviec.com/companies/aurify,AURIFY,,,,,,,"215B10 Nguyễn Văn Hưởng, An Khanh, Ho Chi Minh"
https://itviec.com/companies/fiktech,FikTech,,,,,,,"Phòng 301, Tầng 3, Số 43A-43B, Đường Xuân Thủy, Phường An Khánh, TP Hồ Chí Minh, Ho Chi Minh"
https://itviec.com/companies/cong-ty-tnhh-behn-meyer-viet-nam,Công Ty TNHH Behn Meyer Việt Nam,,,,,,,"36 Đường số 6, KCN Việt Nam - Singapore, Phường An Phú, Ho Chi Minh"
https://itviec.com/companies/kobo-asia,Kobo Asia,,,,,,,"12th Floor, Saigon Prime Office Building, 107-109-111 Nguyen Dinh Chieu Str. Ward 6, Dist.3 HCMC, Ho Chi Minh"
https://itviec.com/companies/pyranexus,Pyranexus,,,,,,,"Tầng 4, 41 Nguyễn Phước Lan, Hòa Xuân, Da Nang"
https://itviec.com/companies/vietbank,Vietbank,,,,,,,"4 Tôn Đức Thắng, Ho Chi Minh"
https://itviec.com/companies/salesnow-co-ltd,"SalesNow Co., Ltd.",,,,,,,"Shibuya, Tokyo, Japan"
https://itviec.com/companies/saigon-new-port,Saigon New Port,,,,,,,"1295 1295B, Nguyễn Thị Định, Phường Cát Lái, Ho Chi Minh"
https://itviec.com/companies/cong-ty-co-phan-citics,CÔNG TY CỔ PHẦN CITICS,,,,,,,"VE-S01, Venice 3, New City, 17 Mai Chi Tho Street, An Khanh, Ho Chi Minh"
https://itviec.com/companies/nexsoft-technology,Nexsoft Technology,,,,,,,"Tòa Nhà Flemington, 182 Lê Đại Hành, Phường Phú Thọ, Phu Tho, Ho Chi Minh"
https://itviec.com/companies/bolt-tech,Bolt Tech,,,,,,,"Tầng 8, Tòa nhà Hapro Building, 11B Cát Linh, Ha Noi"
https://itviec.com/companies/cong-ty-tnhh-thuong-mai-va-xnk-winki-group,Công ty TNHH thương mại và XNK Winki Group,,,,,,,"Tầng 2, Số 56 Sunrise G, The Manor Central Park, Nguyễn Xiển, Đại Kim, Hoàng Mai, Hà Nội, Ha Noi"
https://itviec.com/companies/he-thong-giao-duc-ly-thai-to,Hệ thống Giáo dục Lý Thái Tổ,,,,,,,"Nhà N4-Khuôn viên Trường Mầm non Lý Thái Tổ, số 2 Nguyễn Thị Thập, phường Yên Hoà, Ha Noi"
https://itviec.com/companies/blogic-systems,Blogic Systems,,,,,,,"River Park, phường Phú Hữu, Phước Long B, Ho Chi Minh"
https://itviec.com/companies/tel4vn,TEL4VN,,,,,,,"82/2/9 Đinh Bộ Lĩnh, Binh Thanh, Ho Chi Minh"
https://itviec.com/companies/vsi,VSI,,,,,,,"Tầng 6, AC Building, số 3 ngõ 78 Phố Duy Tân, Dịch Vọng Hậu, Ha Noi"
https://itviec.com/companies/oivan,Oivan,,,,,,,"21 Phung Khac Khoan Street, Sai Gon, Ho Chi Minh"
https://itviec.com/companies/tpisoftware-co-ltd,"TPIsoftware Co., Ltd",,,,,,,"Lầu 7, Phòng 706-707-708 Tòa nhà Hoàng Anh Safomec, số 7/1 Thành Thái, Phường Diên Hồng, Ho Chi Minh"
https://itviec.com/companies/vb-digital,VB Digital,,,,,,,Australia
https://itviec.com/companies/cong-ty-tnhh-stonepine,CÔNG TY TNHH STONEPINE,,,,,,,"Tòa nhà The Sun Avenue, 28 Mai Chí Thọ, phường Bình Trưng, Ho Chi Minh"
https://itviec.com/companies/otto-international,Otto International,,,,,,,"7th Floor, Dinh Le Building, 1 Dinh Le Street, Ward 13, District 4, Xom Chieu, Ho Chi Minh"
https://itviec.com/companies/fetek-technology-company-limited,FETEK Technology Company Limited,,,,,,,"Số 3, ngõ 98 Vũ Trọng Phụng, Ha Noi"
https://itviec.com/companies/exotrails,ExoTrails,,,,,,,"Tầng 2, tòa nhà Itaxa, 126 Nguyễn Thị Minh Khai, Phường Xuân Hòa, Ho Chi Minh"
https://itviec.com/companies/cong-ty-co-phan-tap-doan-go-minh-long,Công Ty Cổ Phần Tập Đoàn Gỗ Minh Long,,,,,,,"Tầng 20, Toà Nhà 319 BQP, 63 Lê Văn Lương, Ha Noi"
https://itviec.com/companies/cong-ty-tnhh-tich-hop-he-thong-nht,CÔNG TY TNHH TÍCH HỢP HỆ THỐNG NHT,,,,,,,"Số nhà 18, Phùng Khoang 2, Tổ Dân Phố số 5, Dai Mo, Ha Noi"
https://itviec.com/companies/abilive-vietnam-co-ltd,"Abilive Vietnam Co., Ltd.",,,,,,,"Tầng 8, số 4, phố Liễu Giai, Phường Ngọc Hà, Thành phố Hà Nội, Việt Nam, Ha Noi"
https://itviec.com/companies/cong-ty-co-phan-kinh-doanh-bat-dong-san-mayhomes,Công ty Cổ phần Kinh doanh Bất động sản Mayhomes,,,,,,,"90 Nguyễn Tuân, Ha Noi"
https://itviec.com/companies/agile-lab-pte-ltd,Agile Lab Pte Ltd,,,,,,,"Work from home , Ho Chi Minh"
https://itviec.com/companies/flyer,FLYER,,,,,,,"Viet A Tower, No.9, Duy Tan Street, Ha Noi"
https://itviec.com/companies/vincent-holdings-co-ltd,VINCENT HOLDINGS CO LTD,,,,,,,"Lầu 7, Tòa nhà Toji, số 384/1C Nam Kỳ Khởi Nghĩa, Phường Xuân Hòa, Xuan Hoa, Ho Chi Minh"
https://itviec.com/companies/romulus-digital,Romulus Digital,,,,,,,"Ha Noi City, Ha Noi"
https://itviec.com/companies/vnsolution,VNSOLUTION,,,,,,,"Đường Thành Thái, Dịch Vọng, Ha Noi"
https://itviec.com/companies/opes-insurance,Opes Insurance,,,,,,,"6th Floor, No 5 Dien Bien Phu Str., Ba Dinh, Ha Noi"
https://itviec.com/companies/fpt-digital,FPT Digital,,,,,,,"FPT Tower, 10 Phạm Văn Bạch, P. Dịch Vọng, Q. Cầu Giấy, Hà Nội, Việt Nam, Ha Noi"
