URL,Name,Rating,City,Jobs,Reviews,Best About,Description,Location
https://itviec.com/companies/pacific-cross-vietnam,Pacific Cross Vietnam,,,,,,,"6th Floor, VNPT Building, 1487 Nguyen Van Linh, Tan Hung Ward, Ho Chi Minh"
https://itviec.com/companies/rightship,RightShip,,,,,,,"9th Floor, 174 Thai Ha Street, Trung Liet Ward, Ha Noi"
https://itviec.com/companies/eyeclick,EyeClick,,,,,,,"15A Nguyễn Trung Trực, Binh Loi Trung, Ho Chi Minh"
https://itviec.com/companies/zalopay,Zalopay,,,,,,,"Z06 Đường số 13, Phường Tân Thuận Đông, Ho Chi Minh"
https://itviec.com/companies/lifetex,LifeteX,,,,,,,"Tầng 19 tòa nhà HH2 Bắc Hà, 15 Tố Hữu, Ha Noi"
https://itviec.com/companies/nakivo,Nakivo,,,,,,,"TGI Building, 208 Nguyen Trai, Ho Chi Minh"
https://itviec.com/companies/digital-unicorn,Digital Unicorn,,,,,,,"3F, 94 Ho Nghinh Street, An Hai Ward, Da Nang"
https://itviec.com/companies/softroad-viet-nam,SoftRoad Việt Nam,,,,,,,"14th floor, Richy Tower, No 35 Mac Thai To, Yen Hoa ward, Cau Giay district, Ha Noi., Cau Giay, Ha Noi"
https://itviec.com/companies/glory-software-vietnam,Glory Software Vietnam,,,,,,,"47 Nui Thanh, Hoa Cuong, Da Nang"
https://itviec.com/companies/verp-technology-solutions-jsc,VERP Technology Solutions JSC,,,,,,,"P728 - KS Thể Thao - Lê Văn Thiêm - Thanh Xuân - Hà Nội, Ha Noi"
https://itviec.com/companies/logistics-technology-application-lta,Logistics Technology Application (LTA),,,,,,,"Công ty Cổ phần Ứng dụng công nghệ Logistics (Logistics Technology Application Joint Stock Company) (LTA), 2A Đường Số 5, An Phú, Ho Chi Minh"
https://itviec.com/companies/cong-ty-co-phan-tap-doan-viet-ba,Công ty Cổ phần Tập đoàn Việt Ba,,,,,,,"273 Kim Mã – Hà Nội, Ha Noi"
https://itviec.com/companies/ssi-securities-corporation,SSI Securities Corporation,,,,,,,"72 Nguyễn Huệ, Ho Chi Minh"
https://itviec.com/companies/beyondsoft-technology-vietnam-company-limited,Beyondsoft Technology (Vietnam) Company Limited,,,,,,,"32 Pham Ngoc Thach, Xuan Hoa, Ho Chi Minh"
https://itviec.com/companies/mercatus,Mercatus,,,,,,,"9th Floor, Dreamplex Building,195 Đien Bien Phu, Gia Dinh Ward, Gia Dinh, Ho Chi Minh"
https://itviec.com/companies/cong-ty-co-phan-dich-vu-giai-phap-cong-nghe-gotrust,CÔNG TY CỔ PHẦN DỊCH VỤ & GIẢI PHÁP CÔNG NGHỆ GOTRUST,,,,,,,"5B Phổ Quang, Phường Tân Sơn Hòa, Ho Chi Minh"
https://itviec.com/companies/remote-resources-vn-rrvn,Remote Resources VN (RRVN),,,,,,,"39 Le Duan, Ho Chi Minh"
https://itviec.com/companies/specom-inc-co-ltd,"SPECOM INC Co., Ltd",,,,,,,"67 Đinh Bộ Lĩnh, Ho Chi Minh"
https://itviec.com/companies/arobid-com,AROBID.COM,,,,,,,"2ⁿᵈ Floor, SECC, 799 Nguyen Van Linh Street, Tan My Ward, Ho Chi Minh"
https://itviec.com/companies/ai-t-2,AI&T,,,,,,,"6th floor, M5 building, 91 Nguyen Chi Thanh street, Giang Vo, Ha Noi"
https://itviec.com/companies/vnggames,VNGGames,,,,,,,"Z06 Street No. 13, Tan Thuan Dong Ward, Ho Chi Minh"
https://itviec.com/companies/future-game-studio,Future Game Studio,,,,,,,"Do Thanh Building, 32 Yersin Street, Ben Thanh Ward, HCM, Ho Chi Minh"
https://itviec.com/companies/national-citizen-bank-ncb,National Citizen Bank | NCB,,,,,,,"Tòa nhà Ancora, số 3 Lương Yên , Hai Ba Trung, Ha Noi"
https://itviec.com/companies/cong-ty-co-phan-giai-phap-tech-vietnam,Công ty Cổ phần Giải pháp Tech Vietnam,,,,,,,"Tầng B1, PVI tower 167 Trung Kính, Ha Noi"
https://itviec.com/companies/nemo-digital-technology,NEMO Digital Technology,,,,,,,"tòa Cmat số 9, ngõ 4 Duy Tân, Ha Noi"
https://itviec.com/companies/it-development-vietnam,IT-Development Vietnam,,,,,,,"9F, 111 Lý Chính Thắng , P. Xuân Hòa, Ho Chi Minh"
https://itviec.com/companies/net-protections-vietnam-co-ltd,"Net Protections Vietnam Co., Ltd.",,,,,,,"87A Ham Nghi, Nguyen Thai Binh ward, Ho Chi Minh"
https://itviec.com/companies/switch-supply-pty-ltd,Switch Supply Pty Ltd,,,,,,,"., Ha Noi"
https://itviec.com/companies/ionah,IONAH,,,,,,,"Tòa HUD 37 Lê Văn Lương, Ha Noi"
https://itviec.com/companies/mymind,MYMIND,,,,,,,"Betrimex Building, No. 63 Cao Thang Street, Ban Co, Ho Chi Minh"
https://itviec.com/companies/cong-ty-co-phan-thanh-toan-so-mobifone,Công ty Cổ phần Thanh toán số MobiFone,,,,,,,"Tầng 30 - Tòa tháp C5 D’Capital, 119 Trần Duy Hưng, Phường Yên Hoà, Thành phố Hà Nội, Việt Nam, Ha Noi"
https://itviec.com/companies/isofh,ISOFH,,,,,,,"Tòa VOV, 35 Nguyễn Đình Chiểu, Hai Ba Trung, Ha Noi"
https://itviec.com/companies/cong-ty-tnhh-spacemind,CÔNG TY TNHH SPACEMIND,,,,,,,"Tòa nhà The Summit Building, 350 Nguyễn Văn Linh, Phường Thanh Khê, Thành phố Đà Nẵng, Việt Nam, Da Nang"
https://itviec.com/companies/cong-ty-co-phan-giao-duc-khoa-hoc-cong-nghe-ichi-skill,Công ty Cổ phần Giáo dục Khoa học Công nghệ ICHI SKILL,,,,,,,"231/1 Nguyễn Phúc Chu, Phường Tân Sơn, Ho Chi Minh"
https://itviec.com/companies/finviet,FINVIET,,,,,,,"34 Hoang Viet, Ho Chi Minh"
https://itviec.com/companies/mb-life,MB Life,,,,,,,"Tầng 15, tòa nhà MB – 21 Cát Linh, phường Cát Linh, Ha Noi"
https://itviec.com/companies/icebear,ICEBEAR,,,,,,,"Floor 8, A3 Tower, Ecolife Capital, No.58 To Huu, Me Tri Ward, Ha Noi"
https://itviec.com/companies/motorola-solutions,Motorola Solutions,,,,,,,"L07.01, Tầng 07, Tháp A, Khu thương mại dịch vụ kết hợp nhà ở cao tầng tại lô đất 1-13, thuộc khu chức năng số 1 – Số 15, đường Trần Bạch Đằng, Phường Thủ Thiêm, Ho Chi Minh"
https://itviec.com/companies/savills-vietnam,SAVILLS VIETNAM,,,,,,,"Savills Vietnam – 18th floor, Doji Tower, 81 - 85 Ham Nghi Street, Nguyen Thai Binh Ward, Ho Chi Minh"
https://itviec.com/companies/cong-ty-co-phan-phan-mem-di-gi-win-viet-nam,CÔNG TY CỔ PHẦN PHẦN MỀM DI GI WIN VIỆT NAM,,,,,,,"Tầng 12A, tòa nhà Golden King, số 15, đường Nguyễn Lương Bằng, Tan Phu, Ho Chi Minh"
https://itviec.com/companies/cong-ty-co-phan-suntek,CÔNG TY CỔ PHẦN SUNTEK,,,,,,,"No.16 Street 5, An Khanh Ward, HCMC, Ho Chi Minh"
https://itviec.com/companies/excelfore-japan,EXCELFORE JAPAN,,,,,,,"The Sun Avenue, 28 Mai Chí Thọ, An Phú, Thủ Đức, Hồ Chí Minh, Ho Chi Minh"
https://itviec.com/companies/commandoss,CommandOSS,,,,,,,"54 - 56 Lê Quốc Hưng, Phường 13, Ho Chi Minh"
https://itviec.com/companies/cong-ty-co-phan-tu-van-dau-tu-va-xay-dung-giao-thong-van-tai,CÔNG TY CỔ PHẦN  TƯ VẤN ĐẦU TƯ VÀ XÂY DỰNG GIAO THÔNG VẬN TẢI,,,,,,,"Số 26, Ngõ 371 Phố Kim Mã, Phường Giảng Võ, Hà Nội, Ha Noi"
https://itviec.com/companies/tinai,Tinai,,,,,,,"., Ho Chi Minh"
https://itviec.com/companies/leansoft,Leansoft,,,,,,,"Tòa nhà Thanh Xuân Complex số 6 Lê Văn Thiêm, Ha Noi"
https://itviec.com/companies/cong-ty-tnhh-salary-viet-nam,Công ty TNHH Salary (Việt Nam),,,,,,,"Tòa nhà Saigon Paragon, 3 Nguyễn Lương Bằng, P. Tân Phú, Ho Chi Minh"
https://itviec.com/companies/birdeye-so,Birdeye.so,,,,,,,"Toong Coworking Space, 4th Floor, N01-T4 Building, Diplomatic Corp. Township, Ha Noi"
https://itviec.com/companies/trung-tam-cntt-tap-doan-bao-viet,Trung tâm CNTT Tập đoàn Bảo Việt,,,,,,,"71 Ngô Sĩ Liên, Ha Noi"
https://itviec.com/companies/srt-group,SRT GROUP,,,,,,,"SRT Miền Nam Tầng 6, 173 Trần Não, Phường An Khánh (TP. Thủ Đức cũ), Ho Chi Minh"
https://itviec.com/companies/airr-labs,AIRR Labs,,,,,,,"Floor 4, SFC Building, 9 Dinh Tien Hoang, Saigon Ward, Ho Chi Minh"
https://itviec.com/companies/cong-ty-co-phan-giao-dich-hang-hoa-gia-cat-loi,Công ty Cổ phần giao dịch hàng hóa Gia Cát Lợi,,,,,,,"163 Nguyễn Thị Nhung, KDC Vạn Phúc, Quốc lộ 13, Phường Hiệp Bình Phước, Ho Chi Minh"
https://itviec.com/companies/wbc-viet-nam,WBC Việt Nam,,,,,,,"Tầng 02, khối A, Tòa nhà Sông Đà, đường Phạm Hùng, phường Mỹ Đình 1, Ha Noi"
https://itviec.com/companies/cong-ty-tnhh-t-m-g,Công Ty TNHH T.M.G,,,,,,,"91 Tan Cang Street, Ward 25, Ho Chi Minh"
https://itviec.com/companies/review-company,"27,881 Reviews of Top IT Companies",,,,,,,
https://itviec.com/companies/realestatedoc,RealEstateDoc,,,,,,,"5A Tran Phu, Ho Chi Minh"
https://itviec.com/companies/cong-ty-tnhh-realtek-viet-nam,Công Ty TNHH Realtek Việt Nam,,,,,,,"Lầu 17, Tòa nhà Etown 5, 364 Cộng Hòa, P. Tân Bình, Ho Chi Minh"
https://itviec.com/companies/finpros,FINPROS,,,,,,,"9th floor, International Plaza Building, 343 Pham Ngu Lao Street, Ben Thanh, Ho Chi Minh"
https://itviec.com/companies/powergate-software,PowerGate Software,,,,,,,"Tầng 6A, Tháp C, tòa nhà Center Point, số 219 Trung Kính, Yên Hòa, Ha Noi"
https://itviec.com/companies/cigro-inc,Cigro Inc.,,,,,,,"The Galleria Metro 6 Building, An Khanh, Ho Chi Minh"
https://itviec.com/companies/st-engineering,ST Engineering,,,,,,,Singapore
https://itviec.com/companies/cong-ty-co-phan-teecom,CÔNG TY CỔ PHẦN TEECOM,,,,,,,"60 Nguyễn Thông, Phường Nhiêu Lộc, Ho Chi Minh"
https://itviec.com/companies/tj-tech,TJ Tech,,,,,,,"Capital Place, 29 Lieu Giai Street, Ngoc Ha Ward, Hanoi., Ngoc Ha, Ha Noi"
https://itviec.com/companies/lotte-finance-vietnam,LOTTE FINANCE VIETNAM,,,,,,,"Tầng 12A, Tháp Tây, tòa nhà LOTTE Center Hà Nội, 54 Liễu Giai, Ha Noi"
https://itviec.com/companies/arsen-kawaijuku-tech-vietnam-co-ltd,"ARSEN Kawaijuku Tech Vietnam Co.,Ltd",,,,,,,"Tầng 9, Tòa nhà TNR, 180-192 Nguyễn Công Trứ, Phường Nguyễn Thái Bình, Ho Chi Minh"
https://itviec.com/companies/nsc-software,NSC Software,,,,,,,"Hà Nội, Ha Noi"
https://itviec.com/companies/acceleratorapp,AcceleratorApp,,,,,,,Overseas
https://itviec.com/companies/t2-soft-company-limited,T2 SOFT COMPANY LIMITED,,,,,,,"Landmark72 Tower, Pham Hung, New Urban Area, Ha Noi"
https://itviec.com/companies/ths-game,THS GAME,,,,,,,"Tầng Lửng, Tòa nhà Saigon View, 117 Nguyễn Cửu Vân, Phường Gia Định, Ho Chi Minh"
https://itviec.com/companies/vsec,VSEC,,,,,,,"Tòa nhà G Group, số 5 Nguyễn Thị Duệ, Yên Hòa, Cầu Giấy. , Ha Noi"
https://itviec.com/companies/sucafina,SUCAFINA,,,,,,,"83 Ngo Thoi Nhiem St., Vo Thi Sau Ward, District 3, Ho Chi Minh"
https://itviec.com/companies/mobifone-solutions,MobiFone Solutions,,,,,,,".38 Phan Đình Phùng, Ba Dinh, Ha Noi"
https://itviec.com/companies/itviec-recruitment-consulting,ITviec Recruitment Consulting,,,,,,,"City, Ho Chi Minh"
https://itviec.com/companies/kamereo,Kamereo,,,,,,,"The Manor 2, 91 Nguyen Huu Canh, Thanh My Tay, Ho Chi Minh"
https://itviec.com/companies/cong-ty-tnhh-cong-nghe-va-truyen-thong-thien-khoi,Công ty TNHH Công nghệ và Truyền thông Thiên Khôi,,,,,,,"Tầng 3, tòa nhà Mipec Tower, 229 Tây Sơn, Khương Thượng, Đống Đa, Ha Noi"
https://itviec.com/companies/huenx-vietnam,HUENX VIETNAM,,,,,,,"91/2 đường Trần Thị Cờ, Khu phố 14, Phường Thới An, TP Hồ Chí Minh, Việt Nam, Ho Chi Minh"
https://itviec.com/companies/advahealth-solutions,AdvaHealth Solutions,,,,,,,"167 – 169 Điện Biên Phủ, Phường Đa Kao, Ho Chi Minh"
https://itviec.com/companies/52-entertainment,52 Entertainment,,,,,,,"Tầng 7, 23 Trần Cao Vân, Phường Đa Kao, Ho Chi Minh"
https://itviec.com/companies/agriseco,Agriseco,,,,,,,"228 Đường 2/9, Da Nang"
https://itviec.com/companies/goline-corporation,Goline Corporation,,,,,,,"Tầng 8, tòa nhà Kim Ánh, 78 Duy Tân, Ha Noi"
https://itviec.com/companies/s4bt-solutions-for-business-travel,S4BT Solutions for Business Travel.,,,,,,,"Five Star Tower, 28bis Mạc Đĩnh Chi, Sai Gon, Ho Chi Minh"
https://itviec.com/companies/cong-ty-co-phan-thuong-mai-duoc-pham-dai-phuc-quang-minh,CÔNG TY CỔ PHẦN THƯƠNG MẠI DƯỢC PHẨM ĐẠI PHÚC QUANG MINH,,,,,,,"B2A2_CN, Đường NE4, Khu công nghiệp Mỹ Phước 3, Phường Mỹ Phước, Thị xã Bến Cát, Tỉnh Bình Dương, Ho Chi Minh"
https://itviec.com/companies/cosigma-io,Cosigma.io,,,,,,,"Mạc Đĩnh Chi, Sai Gon, Ho Chi Minh"
https://itviec.com/companies/cong-ty-co-phan-19,Công ty Cổ phần 19,,,,,,,"tòa Imperia Garden, 143 Nguyễn Tuân, Ha Noi"
https://itviec.com/companies/trustify-technology,Trustify Technology,,,,,,,"307/20-21 Nguyen Van Troi, Tan Son Hoa Ward, Ho Chi Minh"
https://itviec.com/companies/leap,LEAP,,,,,,,"L17-11 Floor 17, Vincom Center, 72 Le Thanh Ton, Sai Gon, Ho Chi Minh"
https://itviec.com/companies/bewao-corporation,BEWAO CORPORATION,,,,,,,"95-97 Nguyễn Cơ Thạch, Phường An Lợi Đông, Thành phố Thủ Đức, TP Hồ Chí Minh, Ho Chi Minh"
https://itviec.com/companies/virtual-security-lab-cyber-risk-management-services-l-l-c,Virtual Security Lab Cyber Risk Management Services L.L.C,,,,,,,"Office 3503, Level 35, Marina Plaza, Al Marsa St - Dubai Marina, Dubai"
https://itviec.com/companies/wilmar-clv-cambodia-laos-vietnam,Wilmar CLV (Cambodia Laos Vietnam),,,,,,,"235 Nguyễn Văn Cừ, Ho Chi Minh"
https://itviec.com/companies/meta-technology-lab-inc,META TECHNOLOGY LAB.INC,,,,,,,"5th Floor, 35 A-B-C Nui Thanh Street, Hoa Cuong Ward, Da Nang City, Vietnam, Da Nang"
https://itviec.com/companies/cong-ty-tnhh-kalasus,CÔNG TY TNHH KALASUS,,,,,,,"44 Đường Ung Văn Khiêm, Phường Thạnh Mỹ Tây, Ho Chi Minh"
https://itviec.com/companies/antada,ANTADA,,,,,,,"01 Nguyễn Văn Nguyễn, Phường Tân Định, Ho Chi Minh"
https://itviec.com/companies/infina-vn,Infina.vn,,,,,,,"Infina Office, 2 Floor, No 30 Nguyen Thi Dieu street, Xuan Hoa Ward, Ho Chi Minh"
https://itviec.com/companies/v-knic,V-Knic,,,,,,,"Tầng 15, Số 06 Nguyễn Văn Linh, Da Nang"
https://itviec.com/companies/cong-ty-tnhh-inception-technologies-global,Công ty TNHH Inception Technologies Global,,,,,,,"Tầng 17, Tòa Intracom 2 Văn Phòng, Số 33 đường Cầu Diễn,Phường Xuân Phương, Ha Noi"
https://itviec.com/companies/dosoftpro,DOSOFTPRO,,,,,,,"Toong Oxygen, 628C Vo Nguyen Giap, An Phu Ward, An Phu, Ho Chi Minh"
https://itviec.com/companies/kosatec-empowering-global-innovation,KOSATEC EMPOWERING GLOBAL INNOVATION,,,,,,,"12th Floor, 68 Phan Dang Luu, Duc Nhuan Ward, Ho Chi Minh City, Ho Chi Minh"
https://itviec.com/companies/wecloud-jsc,WeCloud JSC,,,,,,,"Paxsky Đề Thám - 159C Đề Thám, phường Cầu Ông Lãnh, Ho Chi Minh"
https://itviec.com/companies/laidon-group,Laidon Group,,,,,,,"324 Le Van Sy, Ward 2, Ho Chi Minh"
https://itviec.com/companies/blue-dragon-communications,BLUE DRAGON COMMUNICATIONS,,,,,,,"Apartment B1, D’ Verano Residential, Thu Thiem new urban area, An Khanh Ward, Ho Chi Minh"
https://itviec.com/companies/cong-ty-tnhh-clever-creations-tech,Công Ty TNHH Clever Creations Tech,,,,,,,"459 Sư Vạn Hạnh, Phường 12, Hoa Hung, Ho Chi Minh"
https://itviec.com/companies/orgscale-recruitment,OrgScale Recruitment,,,,,,,"Ha Noi, Ha Noi"
https://itviec.com/companies/softflex-llc-co-ltd,"SOFTFLEX LLC CO.,LTD",,,,,,,"Epic tower, Lane 19 Duy Tan street, Cau Giay, Ha Noi"
https://itviec.com/companies/mk-group,MK Group,,,,,,,"Tòa nhà The Vista - Số 4, ngõ 15 Duy Tân, Ha Noi"
https://itviec.com/companies/cong-ty-co-phan-cong-nghe-nexgen-vn,Công ty Cổ phần Công nghệ NexGen VN,,,,,,,"Số 15, ngõ 71 Nguyễn Thị Định, Yên Hòa, Hà Nội, Yen Hoa, Ha Noi"
https://itviec.com/companies/az-robotics-co-ltd,"AZ-ROBOTICS Co.,Ltd",,,,,,,"458 Nguyễn Hữu Thọ, Cam Le, Da Nang"
https://itviec.com/companies/sun-group,Sun Group,,,,,,,"Sun Ancora, 03 Lương Yên, Hai Ba Trung, Ha Noi"
https://itviec.com/companies/braly-jsc,Braly JSC,,,,,,,"Tòa Garden Hill, số 99 Trần Bình, Nam Từ Liêm, Hà Nội, Ha Noi"
https://itviec.com/companies/cong-ty-co-phan-tu-van-va-thuong-mai-dien-tu-nam-sao-911-group,Công ty cổ phần tư vấn và thương mại điện tử Năm Sao (911 GROUP),,,,,,,"Số 35 ngõ 93 Hoàng Văn Thái, Phường Khương Trung, Quận Thanh Xuân, Thành phố Hà Nội, Ha Noi"
https://itviec.com/companies/inbox4us,Inbox4us,,,,,,,"63 Phạm Ngọc Thạch, Phường 6, Quận 3, Hồ Chí Minh, Việt Nam, Ho Chi Minh"
https://itviec.com/companies/cong-ty-tnhh-hello-viet-nam,Công Ty Tnhh Hello Việt Nam,,,,,,,"Tầng M, Toà nhà TTC số 19 Phố Duy Tân, Ha Noi"
https://itviec.com/companies/awing,AWING,,,,,,,"Tầng 11, Tòa nhà King Building, Số 7 Chùa Bộc, Ha Noi"
https://itviec.com/companies/cong-ty-co-phan-thanh-toan-truc-tuyen-toan-cau,CÔNG TY CỔ PHẦN THANH TOÁN TRỰC TUYẾN TOÀN CẦU,,,,,,,"76-82 Trần Hưng Đạo, phường Bến Thành, Ben Thanh, Ho Chi Minh"
https://itviec.com/companies/magnolia,Magnolia,,,,,,,"Etown 1 Building, Unit 9.2, 364 Cong Hoa Street, Ward 13, Tan Binh District, Ho Chi Minh"
https://itviec.com/companies/vinx-vietnam,VINX VIETNAM,,,,,,,"WASECO building,10 Pho Quang Street, Ho Chi Minh"
https://itviec.com/companies/everfit,Everfit,,,,,,,"12A, Vietinbank building, 36 Tran Quoc Toan, Da Nang, Hai Chau, Da Nang"
https://itviec.com/companies/elotus,eLotus,,,,,,,"G - Office, 19 Cao Thang, Quarter 2, Ho Chi Minh"
https://itviec.com/companies/reliccell,Reliccell,,,,,,,"151A Nguyễn Đình Chiểu, Ho Chi Minh"
https://itviec.com/companies/code-leap,CODE LEAP,,,,,,,"101 Nguyen Cuu Van, Ho Chi Minh"
https://itviec.com/companies/quang-trung-software-development,Quang Trung Software Development,,,,,,,"62 Đường số 6, KDC CityLand Park Hills, Go Vap, Ho Chi Minh"
https://itviec.com/companies/cong-ty-tnhh-finan,CÔNG TY TNHH FINAN,,,,,,,"173 Tran Nao, An Khanh, Ho Chi Minh"
https://itviec.com/companies/the-one-digi-corp,The One Digi Corp,,,,,,,"40 Thien Phuoc, Ward 9, Ho Chi Minh"
https://itviec.com/companies/cong-ty-tnhh-nanyang-biologics-viet-nam,CÔNG TY TNHH NANYANG BIOLOGICS VIỆT NAM,,,,,,,"45-47 Trần Xuân Soạn, Ha Noi"
https://itviec.com/companies/softel-solutions,Softel Solutions,,,,,,,"Tầng 7, Tòa nhà Geleximco, 36 phố Hoàng Cầu, Ô Chợ Dừa, Ha Noi"
https://itviec.com/companies/ctcp-san-giao-dich-tai-san-ma-hoa-viet-nam-thinh-vuong-caex,CTCP SÀN GIAO DỊCH TÀI SẢN MÃ HÓA VIỆT NAM THỊNH VƯỢNG (CAEX),,,,,,,"Tầng 04, Tòa nhà số 5 Điện Biên Phủ, Phường Ba Đình, Ha Noi"
https://itviec.com/companies/annam-software-company,Annam Software Company,,,,,,,"Binh Loi Villa Riverside , Ho Chi Minh"
https://itviec.com/companies/rontech,RONTECH,,,,,,,"Tầng 1, Tòa nhà HSC Building, Số 162B Điện Biên Phủ, Phường Xuân Hòa, Xuan Hoa, Ho Chi Minh"
https://itviec.com/companies/ewoosoft-vietnam,Ewoosoft Vietnam,,,,,,,"19 Duy Tan, Cau Giay, Ha Noi"
https://itviec.com/companies/kds-vietnam,KDS Vietnam,,,,,,,"81 Điện Biên Phủ, Phường Tân Định, Ho Chi Minh"
https://itviec.com/companies/vietpay-corporation,Vietpay Corporation,,,,,,,"Thảo Điền, Ho Chi Minh"
https://itviec.com/companies/innovation-technologies-jsc,Innovation Technologies JSC,,,,,,,"6 Võ Văn Kiệt, P. Nguyễn Thái Bình, Ho Chi Minh"
https://itviec.com/companies/cong-ty-co-phan-cmc-openai,CÔNG TY CỔ PHẦN CMC OPENAI,,,,,,,"Tòa nhà CMC , số 11 Duy Tân, Dịch Vọng Hậu, Cầu Giấy, Hà Nội, Ha Noi"
https://itviec.com/companies/mbamc,MBAMC,,,,,,,"Tòa nhà 175 Giảng Võ, Ha Noi"
https://itviec.com/companies/amigo,Amigo,,,,,,,"2nd floor, Eximland building, 179 EF Cach Mang Thang 8, Ward 5, Ho Chi Minh"
https://itviec.com/companies/teqnological-asia,Teqnological Asia,,,,,,,"301, Block B, Waseco Plaza, 10 Pho Quang, Ho Chi Minh"
https://itviec.com/companies/sqreem-technologies-vn-pte-ltd,Sqreem Technologies (VN) Pte. Ltd.,,,,,,,"WeWork Lim Tower 3, 3rd Floor, 29A Nguyen Dinh Chieu, Dakao ward, Ho Chi Minh"
https://itviec.com/companies/mathpresso-viet-nam,Mathpresso Việt Nam,,,,,,,"Coninco Tower, No.4 Ton That Tung, Trung Tu, Ha Noi"
https://itviec.com/companies/vietmap,Vietmap,,,,,,,"193 Tran Phu, Ward 4, Ho Chi Minh"
